{
  "version": 1,
  "updated_at": "2026-06-10",
  "operating_mode": "fixture-decision-heavy",
  "objective": {
    "id": "fixture-decision-heavy",
    "title": "Queue dominated by open decisions instead of execution.",
    "window": { "start": "2026-06-01", "target_end": "2026-06-30" }
  },
  "tasks": [
    {
      "id": "decide-first-market",
      "title": "Choose the first target market",
      "column": "this_week",
      "project": "Demo Project",
      "manager": "chief_of_staff",
      "owner": "ceo",
      "accepts_result": "user",
      "risk_tier": "medium",
      "autonomy_tier": "A0",
      "workflow": "decision",
      "next_step": "Compare the two candidate segments.",
      "done_when": "Decision brief with a falsifiable recommendation exists.",
      "primary_update_file": "os/03_Decisions/Open_Decisions.md",
      "created_at": "2026-06-08",
      "updated_at": "2026-06-09"
    },
    {
      "id": "decide-pricing-model",
      "title": "Choose subscription vs one-time pricing",
      "column": "this_week",
      "project": "Demo Project",
      "manager": "chief_of_staff",
      "owner": "ceo",
      "accepts_result": "user",
      "risk_tier": "medium",
      "autonomy_tier": "A0",
      "workflow": "decision",
      "next_step": "List revenue and churn assumptions for both models.",
      "done_when": "Decision brief reviewed with finance input.",
      "primary_update_file": "os/03_Decisions/Open_Decisions.md",
      "support": ["finance_analyst"],
      "created_at": "2026-06-08",
      "updated_at": "2026-06-09"
    },
    {
      "id": "decide-stack-migration",
      "title": "Decide whether to migrate the stack now",
      "column": "inbox",
      "project": "Demo Project",
      "manager": "chief_of_staff",
      "owner": "architect",
      "accepts_result": "governor",
      "risk_tier": "high",
      "autonomy_tier": "A0",
      "workflow": "decision",
      "next_step": "Estimate the migration cost and the cost of waiting.",
      "done_when": "Decision brief with reversibility analysis exists.",
      "primary_update_file": "os/03_Decisions/Open_Decisions.md",
      "created_at": "2026-06-10",
      "updated_at": "2026-06-10"
    },
    {
      "id": "decision-heavy-one-exec",
      "title": "Keep the demo environment alive",
      "column": "executing",
      "project": "Demo Project",
      "manager": "ai_ops_lead",
      "owner": "executor",
      "accepts_result": "user",
      "risk_tier": "low",
      "autonomy_tier": "A2",
      "workflow": "project_delivery",
      "next_step": "Renew the demo data set.",
      "done_when": "Demo runs without errors.",
      "primary_update_file": "os/projects.md",
      "created_at": "2026-06-09",
      "updated_at": "2026-06-10"
    }
  ]
}
