{
  "version": 1,
  "updated_at": "2026-06-10",
  "operating_mode": "fixture-overloaded",
  "objective": {
    "id": "fixture-overloaded",
    "title": "Queue with more active tasks than the WIP limit allows.",
    "window": { "start": "2026-06-01", "target_end": "2026-06-30" }
  },
  "tasks": [
    {
      "id": "over-task-1",
      "title": "Draft the landing page",
      "column": "this_week",
      "project": "Demo Project",
      "manager": "chief_of_staff",
      "owner": "executor",
      "accepts_result": "user",
      "risk_tier": "low",
      "autonomy_tier": "A2",
      "workflow": "project_delivery",
      "next_step": "Sketch the layout.",
      "done_when": "Page draft approved.",
      "primary_update_file": "os/projects.md",
      "created_at": "2026-06-08",
      "updated_at": "2026-06-09"
    },
    {
      "id": "over-task-2",
      "title": "Set up analytics",
      "column": "this_week",
      "project": "Demo Project",
      "manager": "chief_of_staff",
      "owner": "executor",
      "accepts_result": "user",
      "risk_tier": "low",
      "autonomy_tier": "A2",
      "workflow": "project_delivery",
      "next_step": "Choose the metrics.",
      "done_when": "Dashboard exists.",
      "primary_update_file": "os/projects.md",
      "created_at": "2026-06-08",
      "updated_at": "2026-06-09"
    },
    {
      "id": "over-task-3",
      "title": "Interview two users",
      "column": "this_week",
      "project": "Demo Project",
      "manager": "chief_of_staff",
      "owner": "researcher",
      "accepts_result": "user",
      "risk_tier": "low",
      "autonomy_tier": "A1",
      "workflow": "project_delivery",
      "next_step": "Write the interview script.",
      "done_when": "Two interviews summarized.",
      "primary_update_file": "os/projects.md",
      "created_at": "2026-06-08",
      "updated_at": "2026-06-09"
    },
    {
      "id": "over-task-4",
      "title": "Refactor the importer",
      "column": "executing",
      "project": "Demo Project",
      "manager": "ai_ops_lead",
      "owner": "executor",
      "accepts_result": "evidence_reviewer",
      "risk_tier": "medium",
      "autonomy_tier": "A2",
      "workflow": "project_delivery",
      "next_step": "Split the parser module.",
      "done_when": "Tests pass after refactor.",
      "primary_update_file": "os/projects.md",
      "created_at": "2026-06-07",
      "updated_at": "2026-06-10"
    },
    {
      "id": "over-task-5",
      "title": "Write the pricing brief",
      "column": "executing",
      "project": "Demo Project",
      "manager": "chief_of_staff",
      "owner": "finance_analyst",
      "accepts_result": "user",
      "risk_tier": "medium",
      "autonomy_tier": "A1",
      "workflow": "decision",
      "next_step": "Compare three pricing options.",
      "done_when": "Brief with a recommendation exists.",
      "primary_update_file": "os/03_Decisions/Open_Decisions.md",
      "created_at": "2026-06-07",
      "updated_at": "2026-06-10"
    },
    {
      "id": "over-task-6",
      "title": "Clean the backlog",
      "column": "executing",
      "project": "Demo Project",
      "manager": "ai_ops_lead",
      "owner": "ai_ops_lead",
      "accepts_result": "user",
      "risk_tier": "low",
      "autonomy_tier": "A2",
      "workflow": "weekly_review",
      "next_step": "Archive dead items.",
      "done_when": "Backlog under 20 items.",
      "primary_update_file": "os/02_Planning/Backlog.md",
      "created_at": "2026-06-07",
      "updated_at": "2026-06-10"
    }
  ]
}
