{
  "version": 1,
  "updated_at": "2026-06-10",
  "operating_mode": "fixture-stale",
  "objective": {
    "id": "fixture-stale",
    "title": "Queue with a task that has not moved for weeks.",
    "window": { "start": "2026-05-01", "target_end": "2026-06-30" }
  },
  "tasks": [
    {
      "id": "stale-forgotten-migration",
      "title": "Migrate the legacy notes",
      "column": "executing",
      "project": "Demo Project",
      "manager": "ai_ops_lead",
      "owner": "executor",
      "accepts_result": "user",
      "risk_tier": "low",
      "autonomy_tier": "A2",
      "workflow": "project_delivery",
      "next_step": "Pick the first folder to migrate.",
      "done_when": "All notes follow the naming convention.",
      "primary_update_file": "os/projects.md",
      "created_at": "2026-05-10",
      "updated_at": "2026-05-20"
    },
    {
      "id": "stale-fresh-task",
      "title": "Prepare the weekly review",
      "column": "this_week",
      "project": "Demo Project",
      "manager": "chief_of_staff",
      "owner": "ai_ops_lead",
      "accepts_result": "user",
      "risk_tier": "low",
      "autonomy_tier": "A1",
      "workflow": "weekly_review",
      "next_step": "Collect last week's outcomes.",
      "done_when": "Review notes written.",
      "primary_update_file": "os/02_Planning/Weekly_Plan.md",
      "created_at": "2026-06-09",
      "updated_at": "2026-06-10"
    }
  ]
}
